FK0009621,,Default,virtual,"MAIN MENUBAR/FOOD/MEAT & SEAFOOD,MAIN MENUBAR/FOOD/MEAT & SEAFOOD/ CHICKEN STRIPS",base,President's Choice Free From Crisp & Crunchy Mild Southern-Style Chicken Wings (700 g),,,,1,Taxable Goods,"Catalog, Search",15.1092,,,,,,,,President's Choice Free From Crisp & Crunchy Mild Southern-Style Chicken Wings (700 g),,,,,,,,,,,Block after Info Column,,,,Use config,,,,,,,Use config,,,,0,1,0,0,1,1,1,10000,1,0,1,1,0,0,1,1,1,0,0,0,,,,,,,,,,,,,,,,
FK0009622,,Default,virtual,"MAIN MENUBAR/FOOD/MEAT & SEAFOOD,MAIN MENUBAR/FOOD/MEAT & SEAFOOD/ CHICKEN BREASTS",base,President's Choice Smokin' Stampede Just Drums Gigantico Chicken Drumettes (907 g),,,,1,Taxable Goods,"Catalog, Search",15.1092,,,,,,,/FK0009622.png,President's Choice Smokin' Stampede Just Drums Gigantico Chicken Drumettes (907 g),/FK0009622.png,,/FK0009622.png,,/FK0009622.png,,,,,,Block after Info Column,,,,Use config,,,,,,,Use config,,,,0,1,0,0,1,1,1,10000,1,0,1,1,0,0,1,1,1,0,0,0,,,,,,,,,,,,,,,,
FK0009623,,Default,virtual,"MAIN MENUBAR/FOOD/MEAT & SEAFOOD,MAIN MENUBAR/FOOD/MEAT & SEAFOOD/ CHICKEN STRIPS",base,"Turkey Nuggets, Breaded (1.81 kg)",,,,1,Taxable Goods,"Catalog, Search",10.8,,,,,,,,"Turkey Nuggets, Breaded (1.81 kg)",,,,,,,,,,,Block after Info Column,,,,Use config,,,,,,,Use config,,,,0,1,0,0,1,1,1,10000,1,0,1,1,0,0,1,1,1,0,0,0,,,,,,,,,,,,,,,,
FK0009624,,Default,virtual,"MAIN MENUBAR/FOOD/MEAT & SEAFOOD,MAIN MENUBAR/FOOD/MEAT & SEAFOOD/ CHICKEN WINGS",base,President's Choice Waffle Cone Chicken with Spicy Maple Syrup Boneless Chicken Breast Fillets (680 g),,,,1,Taxable Goods,"Catalog, Search",14.0292,,,,,,,/FK0009624.png,President's Choice Waffle Cone Chicken with Spicy Maple Syrup Boneless Chicken Breast Fillets (680 g),/FK0009624.png,,/FK0009624.png,,/FK0009624.png,,,,,,Block after Info Column,,,,Use config,,,,,,,Use config,,,,0,1,0,0,1,1,1,10000,1,0,1,1,0,0,1,1,1,0,0,0,,,,,,,,,,,,,,,,
FK0009625,,Default,virtual,"MAIN MENUBAR/FOOD/MEAT & SEAFOOD,MAIN MENUBAR/FOOD/MEAT & SEAFOOD/ GRILLING BURGERS",base,Chicken Parmesan (1130 g),,,,1,Taxable Goods,"Catalog, Search",10.8,,,,,,,,Chicken Parmesan (1130 g),,,,,,,,,,,Block after Info Column,,,,Use config,,,,,,,Use config,,,,0,1,0,0,1,1,1,10000,1,0,1,1,0,0,1,1,1,0,0,0,,,,,,,,,,,,,,,,
FK0009626,,Default,virtual,"MAIN MENUBAR/FOOD/MEAT & SEAFOOD,MAIN MENUBAR/FOOD/MEAT & SEAFOOD/ CHICKEN STRIPS",base,"Janes Boneless Bites, Honey Garlic & Thai (900 g)",,,,1,Taxable Goods,"Catalog, Search",16.1892,,,,,,,,"Janes Boneless Bites, Honey Garlic & Thai (900 g)",,,,,,,,,,,Block after Info Column,,,,Use config,,,,,,,Use config,,,,0,1,0,0,1,1,1,10000,1,0,1,1,0,0,1,1,1,0,0,0,,,,,,,,,,,,,,,,
FK0009627,,Default,virtual,"MAIN MENUBAR/FOOD/MEAT & SEAFOOD,MAIN MENUBAR/FOOD/MEAT & SEAFOOD/ CHICKEN BREASTS",base,"President's Choice Blue Menu Easy Cook Chicken Breasts, Seasoned (750 g)",,,,1,Taxable Goods,"Catalog, Search",11.8584,,,,,,,/FK0009627.png,"President's Choice Blue Menu Easy Cook Chicken Breasts, Seasoned (750 g)",/FK0009627.png,,/FK0009627.png,,/FK0009627.png,,,,,,Block after Info Column,,,,Use config,,,,,,,Use config,,,,0,1,0,0,1,1,1,10000,1,0,1,1,0,0,1,1,1,0,0,0,,,,,,,,,,,,,,,,
FK0009628,,Default,virtual,"MAIN MENUBAR/FOOD/MEAT & SEAFOOD,MAIN MENUBAR/FOOD/MEAT & SEAFOOD/ CHICKEN WINGS",base,No Name Breaded Chicken Burger (1 kg),,,,1,Taxable Goods,"Catalog, Search",7.5384,,,,,,,/FK0009628.png,No Name Breaded Chicken Burger (1 kg),/FK0009628.png,,/FK0009628.png,,/FK0009628.png,,,,,,Block after Info Column,,,,Use config,,,,,,,Use config,,,,0,1,0,0,1,1,1,10000,1,0,1,1,0,0,1,1,1,0,0,0,,,,,,,,,,,,,,,,
FK0009629,,Default,virtual,"MAIN MENUBAR/FOOD/MEAT & SEAFOOD,MAIN MENUBAR/FOOD/MEAT & SEAFOOD/ PIES & DINNERS",base,"No Name Club Pack Seasoned Chicken Breasts, Skinless Boneless (2 kg)",,,,1,Taxable Goods,"Catalog, Search",25.8984,,,,,,,/FK0009629.png,"No Name Club Pack Seasoned Chicken Breasts, Skinless Boneless (2 kg)",/FK0009629.png,,/FK0009629.png,,/FK0009629.png,,,,,,Block after Info Column,,,,Use config,,,,,,,Use config,,,,0,1,0,0,1,1,1,10000,1,0,1,1,0,0,1,1,1,0,0,0,,,,,,,,,,,,,,,,
FK0009630,,Default,virtual,"MAIN MENUBAR/FOOD/MEAT & SEAFOOD,MAIN MENUBAR/FOOD/MEAT & SEAFOOD/ HORS D'OEUVRES & MEATBALLS",base,Maple Leaf Prime Buffalo Wings (800 g),,,,1,Taxable Goods,"Catalog, Search",9.6876,,,,,,,,Maple Leaf Prime Buffalo Wings (800 g),,,,,,,,,,,Block after Info Column,,,,Use config,,,,,,,Use config,,,,0,1,0,0,1,1,1,10000,1,0,1,1,0,0,1,1,1,0,0,0,,,,,,,,,,,,,,,,
FK0009631,,Default,virtual,"MAIN MENUBAR/FOOD/MEAT & SEAFOOD,MAIN MENUBAR/FOOD/MEAT & SEAFOOD/ CHICKEN STRIPS",base,President's Choice Blue Menu Beef Chili with Cornbread Top (900 g),,,,1,Taxable Goods,"Catalog, Search",12.9492,,,,,,,/FK0009631.png,President's Choice Blue Menu Beef Chili with Cornbread Top (900 g),/FK0009631.png,,/FK0009631.png,,/FK0009631.png,,,,,,Block after Info Column,,,,Use config,,,,,,,Use config,,,,0,1,0,0,1,1,1,10000,1,0,1,1,0,0,1,1,1,0,0,0,,,,,,,,,,,,,,,,
FK0009632,,Default,virtual,"MAIN MENUBAR/FOOD/MEAT & SEAFOOD,MAIN MENUBAR/FOOD/MEAT & SEAFOOD/ CHICKEN WINGS",base,"President's Choice Swedish Meatball, Club Pack (1.81 kg)",,,,1,Taxable Goods,"Catalog, Search",19.44,,,,,,,/FK0009632.png,"President's Choice Swedish Meatball, Club Pack (1.81 kg)",/FK0009632.png,,/FK0009632.png,,/FK0009632.png,,,,,,Block after Info Column,,,,Use config,,,,,,,Use config,,,,0,1,0,0,1,1,1,10000,1,0,1,1,0,0,1,1,1,0,0,0,,,,,,,,,,,,,,,,
FK0009633,,Default,virtual,"MAIN MENUBAR/FOOD/MEAT & SEAFOOD,MAIN MENUBAR/FOOD/MEAT & SEAFOOD/ CHICKEN STRIPS",base,Janes Star Wars Chicken Nuggets (600 g),,,,1,Taxable Goods,"Catalog, Search",10.7892,,,,,,,/FK0009633.png,Janes Star Wars Chicken Nuggets (600 g),/FK0009633.png,,/FK0009633.png,,/FK0009633.png,,,,,,Block after Info Column,,,,Use config,,,,,,,Use config,,,,0,1,0,0,1,1,1,10000,1,0,1,1,0,0,1,1,1,0,0,0,,,,,,,,,,,,,,,,
FK0009634,,Default,virtual,"MAIN MENUBAR/FOOD/MEAT & SEAFOOD,MAIN MENUBAR/FOOD/MEAT & SEAFOOD/ STEAKS & LOINS",base,"No Name Club Pack Club Pack Chicken Wings, Split (2 kg)",,,,1,Taxable Goods,"Catalog, Search",21.5784,,,,,,,/FK0009634.png,"No Name Club Pack Club Pack Chicken Wings, Split (2 kg)",/FK0009634.png,,/FK0009634.png,,/FK0009634.png,,,,,,Block after Info Column,,,,Use config,,,,,,,Use config,,,,0,1,0,0,1,1,1,10000,1,0,1,1,0,0,1,1,1,0,0,0,,,,,,,,,,,,,,,,
FK0009635,,Default,virtual,"MAIN MENUBAR/FOOD/MEAT & SEAFOOD,MAIN MENUBAR/FOOD/MEAT & SEAFOOD/ STEW CHOPS",base,Chicken Fries (1.81 kg),,,,1,Taxable Goods,"Catalog, Search",10.8,,,,,,,,Chicken Fries (1.81 kg),,,,,,,,,,,Block after Info Column,,,,Use config,,,,,,,Use config,,,,0,1,0,0,1,1,1,10000,1,0,1,1,0,0,1,1,1,0,0,0,,,,,,,,,,,,,,,,
FK0009636,,Default,virtual,"MAIN MENUBAR/FOOD/MEAT & SEAFOOD,MAIN MENUBAR/FOOD/MEAT & SEAFOOD/ STEAKS & LOINS",base,President's Choice Lamb Loin Chop,,,,1,Taxable Goods,"Catalog, Search",13.122,,,,,,,/FK0009636.png,President's Choice Lamb Loin Chop,/FK0009636.png,,/FK0009636.png,,/FK0009636.png,,,,,,Block after Info Column,,,,Use config,,,,,,,Use config,,,,0,1,0,0,1,1,1,10000,1,0,1,1,0,0,1,1,1,0,0,0,,,,,,,,,,,,,,,,
FK0009637,,Default,virtual,"MAIN MENUBAR/FOOD/MEAT & SEAFOOD,MAIN MENUBAR/FOOD/MEAT & SEAFOOD/ STEW CHOPS",base,"Goat Stew Meat, Bone In (1 kg)",,,,1,Taxable Goods,"Catalog, Search",22.6692,,,,,,,/FK0009637.png,"Goat Stew Meat, Bone In (1 kg)",/FK0009637.png,,/FK0009637.png,,/FK0009637.png,,,,,,Block after Info Column,,,,Use config,,,,,,,Use config,,,,0,1,0,0,1,1,1,10000,1,0,1,1,0,0,1,1,1,0,0,0,,,,,,,,,,,,,,,,
FK0009638,,Default,virtual,"MAIN MENUBAR/FOOD/MEAT & SEAFOOD,MAIN MENUBAR/FOOD/MEAT & SEAFOOD/ GROUND AND OFFAL",base,Lamb Shoulder Chops,,,,1,Taxable Goods,"Catalog, Search",15.3684,,,,,,,,Lamb Shoulder Chops,,,,,,,,,,,Block after Info Column,,,,Use config,,,,,,,Use config,,,,0,1,0,0,1,1,1,10000,1,0,1,1,0,0,1,1,1,0,0,0,,,,,,,,,,,,,,,,
FK0009639,,Default,virtual,"MAIN MENUBAR/FOOD/MEAT & SEAFOOD,MAIN MENUBAR/FOOD/MEAT & SEAFOOD/ ROASTS & RIBS",base,"Lamb Stew Meat, Bone In (1.25 kg)",,,,1,Taxable Goods,"Catalog, Search",22.6692,,,,,,,/FK0009639.png,"Lamb Stew Meat, Bone In (1.25 kg)",/FK0009639.png,,/FK0009639.png,,/FK0009639.png,,,,,,Block after Info Column,,,,Use config,,,,,,,Use config,,,,0,1,0,0,1,1,1,10000,1,0,1,1,0,0,1,1,1,0,0,0,,,,,,,,,,,,,,,,
FK0009640,,Default,virtual,"MAIN MENUBAR/FOOD/MEAT & SEAFOOD,MAIN MENUBAR/FOOD/MEAT & SEAFOOD/ STEW CHOPS",base,Lean Ground Lamb (500 g),,,,1,Taxable Goods,"Catalog, Search",11.8692,,,,,,,/FK0009640.png,Lean Ground Lamb (500 g),/FK0009640.png,,/FK0009640.png,,/FK0009640.png,,,,,,Block after Info Column,,,,Use config,,,,,,,Use config,,,,0,1,0,0,1,1,1,10000,1,0,1,1,0,0,1,1,1,0,0,0,,,,,,,,,,,,,,,,
FK0009641,,Default,virtual,"MAIN MENUBAR/FOOD/MEAT & SEAFOOD,MAIN MENUBAR/FOOD/MEAT & SEAFOOD/ ROASTS & RIBS",base,President's Choice Australian Lamb Frozen Short Cut Leg of Lamb,,,,1,Taxable Goods,"Catalog, Search",45.9324,,,,,,,/FK0009641.png,President's Choice Australian Lamb Frozen Short Cut Leg of Lamb,/FK0009641.png,,/FK0009641.png,,/FK0009641.png,,,,,,Block after Info Column,,,,Use config,,,,,,,Use config,,,,0,1,0,0,1,1,1,10000,1,0,1,1,0,0,1,1,1,0,0,0,,,,,,,,,,,,,,,,
FK0009642,,Default,virtual,"MAIN MENUBAR/FOOD/MEAT & SEAFOOD,MAIN MENUBAR/FOOD/MEAT & SEAFOOD/ ROASTS & RIBS",base,"President's Choice Lamb Shank, Frozen",,,,1,Taxable Goods,"Catalog, Search",17.172,,,,,,,/FK0009642.png,"President's Choice Lamb Shank, Frozen",/FK0009642.png,,/FK0009642.png,,/FK0009642.png,,,,,,Block after Info Column,,,,Use config,,,,,,,Use config,,,,0,1,0,0,1,1,1,10000,1,0,1,1,0,0,1,1,1,0,0,0,,,,,,,,,,,,,,,,
FK0009643,,Default,virtual,"MAIN MENUBAR/FOOD/MEAT & SEAFOOD,MAIN MENUBAR/FOOD/MEAT & SEAFOOD/ ROASTS & RIBS",base,"President's Choice Lamb Leg, Boneless",,,,1,Taxable Goods,"Catalog, Search",26.352,,,,,,,/FK0009643.png,"President's Choice Lamb Leg, Boneless",/FK0009643.png,,/FK0009643.png,,/FK0009643.png,,,,,,Block after Info Column,,,,Use config,,,,,,,Use config,,,,0,1,0,0,1,1,1,10000,1,0,1,1,0,0,1,1,1,0,0,0,,,,,,,,,,,,,,,,
FK0009644,,Default,virtual,"MAIN MENUBAR/FOOD/MEAT & SEAFOOD,MAIN MENUBAR/FOOD/MEAT & SEAFOOD/ STEAKS & LOINS",base,"President's Choice Rack Of Lamb, Frenched",,,,1,Taxable Goods,"Catalog, Search",24.6132,,,,,,,/FK0009644.png,"President's Choice Rack Of Lamb, Frenched",/FK0009644.png,,/FK0009644.png,,/FK0009644.png,,,,,,Block after Info Column,,,,Use config,,,,,,,Use config,,,,0,1,0,0,1,1,1,10000,1,0,1,1,0,0,1,1,1,0,0,0,,,,,,,,,,,,,,,,
FK0009645,,Default,virtual,"MAIN MENUBAR/FOOD/MEAT & SEAFOOD,MAIN MENUBAR/FOOD/MEAT & SEAFOOD/ORGANIC DAIRY",base,"Lamb Shoulder, Boneless Australian Frozen",,,,1,Taxable Goods,"Catalog, Search",19.2456,,,,,,,,"Lamb Shoulder, Boneless Australian Frozen",,,,,,,,,,,Block after Info Column,,,,Use config,,,,,,,Use config,,,,0,1,0,0,1,1,1,10000,1,0,1,1,0,0,1,1,1,0,0,0,,,,,,,,,,,,,,,,
FK0009646,,Default,virtual,"MAIN MENUBAR/FOOD/MEAT & SEAFOOD,MAIN MENUBAR/FOOD/MEAT & SEAFOOD/ORGANIC DAIRY",base,Lamb Loin Chops,,,,1,Taxable Goods,"Catalog, Search",10.7892,,,,,,,,Lamb Loin Chops,,,,,,,,,,,Block after Info Column,,,,Use config,,,,,,,Use config,,,,0,1,0,0,1,1,1,10000,1,0,1,1,0,0,1,1,1,0,0,0,,,,,,,,,,,,,,,,
FK0009647,,Default,virtual,"MAIN MENUBAR/FOOD/MEAT & SEAFOOD,MAIN MENUBAR/FOOD/MEAT & SEAFOOD/ RIBS & ROASTS",base,Vegenaise Organic Dressing and Sandwich Spread (473 mL),,,,1,Taxable Goods,"Catalog, Search",7.8624,,,,,,,/FK0009647.png,Vegenaise Organic Dressing and Sandwich Spread (473 mL),/FK0009647.png,,/FK0009647.png,,/FK0009647.png,,,,,,Block after Info Column,,,,Use config,,,,,,,Use config,,,,0,1,0,0,1,1,1,10000,1,0,1,1,0,0,1,1,1,0,0,0,,,,,,,,,,,,,,,,
FK0009648,,Default,virtual,"MAIN MENUBAR/FOOD/MEAT & SEAFOOD,MAIN MENUBAR/FOOD/MEAT & SEAFOOD/ HAM",base,"Liberte Organic Yogurt, Wild Blueberry 2.5% (650 g)",,,,1,Taxable Goods,"Catalog, Search",4.8384,,,,,,,/FK0009648.png,"Liberte Organic Yogurt, Wild Blueberry 2.5% (650 g)",/FK0009648.png,,/FK0009648.png,,/FK0009648.png,,,,,,Block after Info Column,,,,Use config,,,,,,,Use config,,,,0,1,0,0,1,1,1,10000,1,0,1,1,0,0,1,1,1,0,0,0,,,,,,,,,,,,,,,,
FK0009649,,Default,virtual,"MAIN MENUBAR/FOOD/MEAT & SEAFOOD,MAIN MENUBAR/FOOD/MEAT & SEAFOOD/ HAM",base,Pork Back Ribs,,,,1,Taxable Goods,"Catalog, Search",21.492,,,,,,,,Pork Back Ribs,,,,,,,,,,,Block after Info Column,,,,Use config,,,,,,,Use config,,,,0,1,0,0,1,1,1,10000,1,0,1,1,0,0,1,1,1,0,0,0,,,,,,,,,,,,,,,,
FK0009650,,Default,virtual,"MAIN MENUBAR/FOOD/MEAT & SEAFOOD,MAIN MENUBAR/FOOD/MEAT & SEAFOOD/ HAM",base,Maple Leaf Country Kitchen Black Forest Ham (800 g),,,,1,Taxable Goods,"Catalog, Search",14.0184,,,,,,,/FK0009650.png,Maple Leaf Country Kitchen Black Forest Ham (800 g),/FK0009650.png,,/FK0009650.png,,/FK0009650.png,,,,,,Block after Info Column,,,,Use config,,,,,,,Use config,,,,0,1,0,0,1,1,1,10000,1,0,1,1,0,0,1,1,1,0,0,0,,,,,,,,,,,,,,,,
FK0009651,,Default,virtual,"MAIN MENUBAR/FOOD/MEAT & SEAFOOD,MAIN MENUBAR/FOOD/MEAT & SEAFOOD/ BACON",base,"Mitchell's Gourmet Foods Toupie Ham, Whole (1.7 kg)",,,,1,Taxable Goods,"Catalog, Search",12.9384,,,,,,,,"Mitchell's Gourmet Foods Toupie Ham, Whole (1.7 kg)",,,,,,,,,,,Block after Info Column,,,,Use config,,,,,,,Use config,,,,0,1,0,0,1,1,1,10000,1,0,1,1,0,0,1,1,1,0,0,0,,,,,,,,,,,,,,,,
FK0009652,,Default,virtual,"MAIN MENUBAR/FOOD/MEAT & SEAFOOD,MAIN MENUBAR/FOOD/MEAT & SEAFOOD/ BACON",base,Cooks Premium Lean Hickory Smoked Ham Steak (454 g),,,,1,Taxable Goods,"Catalog, Search",7.5492,,,,,,,/FK0009652.png,Cooks Premium Lean Hickory Smoked Ham Steak (454 g),/FK0009652.png,,/FK0009652.png,,/FK0009652.png,,,,,,Block after Info Column,,,,Use config,,,,,,,Use config,,,,0,1,0,0,1,1,1,10000,1,0,1,1,0,0,1,1,1,0,0,0,,,,,,,,,,,,,,,,
FK0009653,,Default,virtual,"MAIN MENUBAR/FOOD/MEAT & SEAFOOD,MAIN MENUBAR/FOOD/MEAT & SEAFOOD/ CHOPS & STEAKS",base,"President's Choice Bacon Slices, Fully Cooked (65 g)",,,,1,Taxable Goods,"Catalog, Search",6.48,,,,,,,/FK0009653.png,"President's Choice Bacon Slices, Fully Cooked (65 g)",/FK0009653.png,,/FK0009653.png,,/FK0009653.png,,,,,,Block after Info Column,,,,Use config,,,,,,,Use config,,,,0,1,0,0,1,1,1,10000,1,0,1,1,0,0,1,1,1,0,0,0,,,,,,,,,,,,,,,,
FK0009654,,Default,virtual,"MAIN MENUBAR/FOOD/MEAT & SEAFOOD,MAIN MENUBAR/FOOD/MEAT & SEAFOOD/ HAM",base,Harvest Applewood Bacon (500 g),,,,1,Taxable Goods,"Catalog, Search",9.6984,,,,,,,/FK0009654.png,Harvest Applewood Bacon (500 g),/FK0009654.png,,/FK0009654.png,,/FK0009654.png,,,,,,Block after Info Column,,,,Use config,,,,,,,Use config,,,,0,1,0,0,1,1,1,10000,1,0,1,1,0,0,1,1,1,0,0,0,,,,,,,,,,,,,,,,
FK0009655,,Default,virtual,"MAIN MENUBAR/FOOD/MEAT & SEAFOOD,MAIN MENUBAR/FOOD/MEAT & SEAFOOD/ HAM",base,"Pork Loin Centre Chops, Boneless",,,,1,Taxable Goods,"Catalog, Search",8.0892,,,,,,,,"Pork Loin Centre Chops, Boneless",,,,,,,,,,,Block after Info Column,,,,Use config,,,,,,,Use config,,,,0,1,0,0,1,1,1,10000,1,0,1,1,0,0,1,1,1,0,0,0,,,,,,,,,,,,,,,,
FK0009656,,Default,virtual,"MAIN MENUBAR/FOOD/MEAT & SEAFOOD,MAIN MENUBAR/FOOD/MEAT & SEAFOOD/ TENDERLOIN",base,President's Choice Free From Smoked Ham (700 g),,,,1,Taxable Goods,"Catalog, Search",10.7892,,,,,,,/FK0009656.png,President's Choice Free From Smoked Ham (700 g),/FK0009656.png,,/FK0009656.png,,/FK0009656.png,,,,,,Block after Info Column,,,,Use config,,,,,,,Use config,,,,0,1,0,0,1,1,1,10000,1,0,1,1,0,0,1,1,1,0,0,0,,,,,,,,,,,,,,,,
FK0009657,,Default,virtual,"MAIN MENUBAR/FOOD/MEAT & SEAFOOD,MAIN MENUBAR/FOOD/MEAT & SEAFOOD/ CHOPS & STEAKS",base,Cook's Portion Ham,,,,1,Taxable Goods,"Catalog, Search",29.16,,,,,,,/FK0009657.png,Cook's Portion Ham,/FK0009657.png,,/FK0009657.png,,/FK0009657.png,,,,,,Block after Info Column,,,,Use config,,,,,,,Use config,,,,0,1,0,0,1,1,1,10000,1,0,1,1,0,0,1,1,1,0,0,0,,,,,,,,,,,,,,,,
FK0009658,,Default,virtual,"MAIN MENUBAR/FOOD/MEAT & SEAFOOD,MAIN MENUBAR/FOOD/MEAT & SEAFOOD/ CHOPS & STEAKS",base,Free From Pork Tenderloin,,,,1,Taxable Goods,"Catalog, Search",12.8412,,,,,,,/FK0009658.png,Free From Pork Tenderloin,/FK0009658.png,,/FK0009658.png,,/FK0009658.png,,,,,,Block after Info Column,,,,Use config,,,,,,,Use config,,,,0,1,0,0,1,1,1,10000,1,0,1,1,0,0,1,1,1,0,0,0,,,,,,,,,,,,,,,,
FK0009659,,Default,virtual,"MAIN MENUBAR/FOOD/MEAT & SEAFOOD,MAIN MENUBAR/FOOD/MEAT & SEAFOOD/ CHOPS & STEAKS",base,"Boneless Pork Rib End Chops, Club Pack",,,,1,Taxable Goods,"Catalog, Search",17.0316,,,,,,,/FK0009659.png,"Boneless Pork Rib End Chops, Club Pack",/FK0009659.png,,/FK0009659.png,,/FK0009659.png,,,,,,Block after Info Column,,,,Use config,,,,,,,Use config,,,,0,1,0,0,1,1,1,10000,1,0,1,1,0,0,1,1,1,0,0,0,,,,,,,,,,,,,,,,
FK0009660,,Default,virtual,"MAIN MENUBAR/FOOD/MEAT & SEAFOOD,MAIN MENUBAR/FOOD/MEAT & SEAFOOD/ RIBS & ROASTS",base,President's Choice Free From Pork Rib-Eye Steak,,,,1,Taxable Goods,"Catalog, Search",6.7284,,,,,,,/FK0009660.png,President's Choice Free From Pork Rib-Eye Steak,/FK0009660.png,,/FK0009660.png,,/FK0009660.png,,,,,,Block after Info Column,,,,Use config,,,,,,,Use config,,,,0,1,0,0,1,1,1,10000,1,0,1,1,0,0,1,1,1,0,0,0,,,,,,,,,,,,,,,,
FK0009661,,Default,virtual,"MAIN MENUBAR/FOOD/MEAT & SEAFOOD,MAIN MENUBAR/FOOD/MEAT & SEAFOOD/ CHOPS & STEAKS",base,President's Choice Free From Pork Loin Chop Center Cut,,,,1,Taxable Goods,"Catalog, Search",7.9488,,,,,,,,President's Choice Free From Pork Loin Chop Center Cut,,,,,,,,,,,Block after Info Column,,,,Use config,,,,,,,Use config,,,,0,1,0,0,1,1,1,10000,1,0,1,1,0,0,1,1,1,0,0,0,,,,,,,,,,,,,,,,
FK0009662,,Default,virtual,"MAIN MENUBAR/FOOD/MEAT & SEAFOOD,MAIN MENUBAR/FOOD/MEAT & SEAFOOD/ BACON",base,President's Choice Free From Pork Side Rib,,,,1,Taxable Goods,"Catalog, Search",13.8564,,,,,,,/FK0009662.png,President's Choice Free From Pork Side Rib,/FK0009662.png,,/FK0009662.png,,/FK0009662.png,,,,,,Block after Info Column,,,,Use config,,,,,,,Use config,,,,0,1,0,0,1,1,1,10000,1,0,1,1,0,0,1,1,1,0,0,0,,,,,,,,,,,,,,,,
FK0009663,,Default,virtual,"MAIN MENUBAR/FOOD/MEAT & SEAFOOD,MAIN MENUBAR/FOOD/MEAT & SEAFOOD/ RIBS & ROASTS",base,"Pork Sirloin Chop, Bone In",,,,1,Taxable Goods,"Catalog, Search",9.828,,,,,,,,"Pork Sirloin Chop, Bone In",,,,,,,,,,,Block after Info Column,,,,Use config,,,,,,,Use config,,,,0,1,0,0,1,1,1,10000,1,0,1,1,0,0,1,1,1,0,0,0,,,,,,,,,,,,,,,,
FK0009664,,Default,virtual,"MAIN MENUBAR/FOOD/MEAT & SEAFOOD,MAIN MENUBAR/FOOD/MEAT & SEAFOOD/ BACON",base,Maple Leaf Canadian Craft Whisky Soaked Bacon (375 g),,,,1,Taxable Goods,"Catalog, Search",7.5384,,,,,,,/FK0009664.png,Maple Leaf Canadian Craft Whisky Soaked Bacon (375 g),/FK0009664.png,,/FK0009664.png,,/FK0009664.png,,,,,,Block after Info Column,,,,Use config,,,,,,,Use config,,,,0,1,0,0,1,1,1,10000,1,0,1,1,0,0,1,1,1,0,0,0,,,,,,,,,,,,,,,,
FK0009665,,Default,virtual,"MAIN MENUBAR/FOOD/MEAT & SEAFOOD,MAIN MENUBAR/FOOD/MEAT & SEAFOOD/ CHOPS & STEAKS",base,Sweet & Sour Pork Side Ribs,,,,1,Taxable Goods,"Catalog, Search",29.0844,,,,,,,/FK0009665.png,Sweet & Sour Pork Side Ribs,/FK0009665.png,,/FK0009665.png,,/FK0009665.png,,,,,,Block after Info Column,,,,Use config,,,,,,,Use config,,,,0,1,0,0,1,1,1,10000,1,0,1,1,0,0,1,1,1,0,0,0,,,,,,,,,,,,,,,,
FK0009666,,Default,virtual,"MAIN MENUBAR/FOOD/MEAT & SEAFOOD,MAIN MENUBAR/FOOD/MEAT & SEAFOOD/ BACON",base,Traditional Bacon (500 g),,,,1,Taxable Goods,"Catalog, Search",3.7584,,,,,,,/FK0009666.png,Traditional Bacon (500 g),/FK0009666.png,,/FK0009666.png,,/FK0009666.png,,,,,,Block after Info Column,,,,Use config,,,,,,,Use config,,,,0,1,0,0,1,1,1,10000,1,0,1,1,0,0,1,1,1,0,0,0,,,,,,,,,,,,,,,,
FK0009667,,Default,virtual,"MAIN MENUBAR/FOOD/MEAT & SEAFOOD,MAIN MENUBAR/FOOD/MEAT & SEAFOOD/ RIBS & ROASTS",base,President's Choice Fast Fry Pork Center Chop,,,,1,Taxable Goods,"Catalog, Search",7.1388,,,,,,,,President's Choice Fast Fry Pork Center Chop,,,,,,,,,,,Block after Info Column,,,,Use config,,,,,,,Use config,,,,0,1,0,0,1,1,1,10000,1,0,1,1,0,0,1,1,1,0,0,0,,,,,,,,,,,,,,,,
FK0009668,,Default,virtual,"MAIN MENUBAR/FOOD/MEAT & SEAFOOD,MAIN MENUBAR/FOOD/MEAT & SEAFOOD/ BACON",base,President's Choice Free From Bacon (375 g),,,,1,Taxable Goods,"Catalog, Search",7.5384,,,,,,,/FK0009668.png,President's Choice Free From Bacon (375 g),/FK0009668.png,,/FK0009668.png,,/FK0009668.png,,,,,,Block after Info Column,,,,Use config,,,,,,,Use config,,,,0,1,0,0,1,1,1,10000,1,0,1,1,0,0,1,1,1,0,0,0,,,,,,,,,,,,,,,,
FK0009669,,Default,virtual,"MAIN MENUBAR/FOOD/MEAT & SEAFOOD,MAIN MENUBAR/FOOD/MEAT & SEAFOOD/ BACON",base,Pork Shoulder Picnic Roast,,,,1,Taxable Goods,"Catalog, Search",16.0272,,,,,,,,Pork Shoulder Picnic Roast,,,,,,,,,,,Block after Info Column,,,,Use config,,,,,,,Use config,,,,0,1,0,0,1,1,1,10000,1,0,1,1,0,0,1,1,1,0,0,0,,,,,,,,,,,,,,,,
FK0009670,,Default,virtual,"MAIN MENUBAR/FOOD/MEAT & SEAFOOD,MAIN MENUBAR/FOOD/MEAT & SEAFOOD/ TENDERLOIN",base,Harvest Side Bacon (500 g),,,,1,Taxable Goods,"Catalog, Search",9.6984,,,,,,,/FK0009670.png,Harvest Side Bacon (500 g),/FK0009670.png,,/FK0009670.png,,/FK0009670.png,,,,,,Block after Info Column,,,,Use config,,,,,,,Use config,,,,0,1,0,0,1,1,1,10000,1,0,1,1,0,0,1,1,1,0,0,0,,,,,,,,,,,,,,,,
FK0009671,,Default,virtual,"MAIN MENUBAR/FOOD/MEAT & SEAFOOD,MAIN MENUBAR/FOOD/MEAT & SEAFOOD/ BACON",base,Maple Leaf Bacon (375 g),,,,1,Taxable Goods,"Catalog, Search",4.2876,,,,,,,/FK0009671.png,Maple Leaf Bacon (375 g),/FK0009671.png,,/FK0009671.png,,/FK0009671.png,,,,,,Block after Info Column,,,,Use config,,,,,,,Use config,,,,0,1,0,0,1,1,1,10000,1,0,1,1,0,0,1,1,1,0,0,0,,,,,,,,,,,,,,,,
FK0009672,,Default,virtual,"MAIN MENUBAR/FOOD/MEAT & SEAFOOD,MAIN MENUBAR/FOOD/MEAT & SEAFOOD/ RIBS & ROASTS",base,Pork Tenderloin,,,,1,Taxable Goods,"Catalog, Search",21.8052,,,,,,,/FK0009672.png,Pork Tenderloin,/FK0009672.png,,/FK0009672.png,,/FK0009672.png,,,,,,Block after Info Column,,,,Use config,,,,,,,Use config,,,,0,1,0,0,1,1,1,10000,1,0,1,1,0,0,1,1,1,0,0,0,,,,,,,,,,,,,,,,
FK0009673,,Default,virtual,"MAIN MENUBAR/FOOD/MEAT & SEAFOOD,MAIN MENUBAR/FOOD/MEAT & SEAFOOD/ BACON",base,Maple Leaf Schneider's Country Naturals Bacon (375 g),,,,1,Taxable Goods,"Catalog, Search",7.5384,,,,,,,/FK0009673.png,Maple Leaf Schneider's Country Naturals Bacon (375 g),/FK0009673.png,,/FK0009673.png,,/FK0009673.png,,,,,,Block after Info Column,,,,Use config,,,,,,,Use config,,,,0,1,0,0,1,1,1,10000,1,0,1,1,0,0,1,1,1,0,0,0,,,,,,,,,,,,,,,,
FK0009674,,Default,virtual,"MAIN MENUBAR/FOOD/MEAT & SEAFOOD,MAIN MENUBAR/FOOD/MEAT & SEAFOOD/ CHOPS & STEAKS",base,"Pork Picnic Roast, Club Pack",,,,1,Taxable Goods,"Catalog, Search",26.5788,,,,,,,/FK0009674.png,"Pork Picnic Roast, Club Pack",/FK0009674.png,,/FK0009674.png,,/FK0009674.png,,,,,,Block after Info Column,,,,Use config,,,,,,,Use config,,,,0,1,0,0,1,1,1,10000,1,0,1,1,0,0,1,1,1,0,0,0,,,,,,,,,,,,,,,,
FK0009675,,Default,virtual,"MAIN MENUBAR/FOOD/MEAT & SEAFOOD,MAIN MENUBAR/FOOD/MEAT & SEAFOOD/ RIBS & ROASTS",base,"President's Choice Applewood Bacon, Sliced (500 g)",,,,1,Taxable Goods,"Catalog, Search",8.9532,,,,,,,/FK0009675.png,"President's Choice Applewood Bacon, Sliced (500 g)",/FK0009675.png,,/FK0009675.png,,/FK0009675.png,,,,,,Block after Info Column,,,,Use config,,,,,,,Use config,,,,0,1,0,0,1,1,1,10000,1,0,1,1,0,0,1,1,1,0,0,0,,,,,,,,,,,,,,,,
FK0009676,,Default,virtual,"MAIN MENUBAR/FOOD/MEAT & SEAFOOD,MAIN MENUBAR/FOOD/MEAT & SEAFOOD/ RIBS & ROASTS",base,"Schneiders Smoked Ham Steak, Low Fat (175 g)",,,,1,Taxable Goods,"Catalog, Search",5.3892,,,,,,,/FK0009676.png,"Schneiders Smoked Ham Steak, Low Fat (175 g)",/FK0009676.png,,/FK0009676.png,,/FK0009676.png,,,,,,Block after Info Column,,,,Use config,,,,,,,Use config,,,,0,1,0,0,1,1,1,10000,1,0,1,1,0,0,1,1,1,0,0,0,,,,,,,,,,,,,,,,
FK0009677,,Default,virtual,"MAIN MENUBAR/FOOD/MEAT & SEAFOOD,MAIN MENUBAR/FOOD/MEAT & SEAFOOD/ BACON",base,"Pork Rib Roast, Bone In",,,,1,Taxable Goods,"Catalog, Search",18.0036,,,,,,,/FK0009677.png,"Pork Rib Roast, Bone In",/FK0009677.png,,/FK0009677.png,,/FK0009677.png,,,,,,Block after Info Column,,,,Use config,,,,,,,Use config,,,,0,1,0,0,1,1,1,10000,1,0,1,1,0,0,1,1,1,0,0,0,,,,,,,,,,,,,,,,
FK0009678,,Default,virtual,"MAIN MENUBAR/FOOD/MEAT & SEAFOOD,MAIN MENUBAR/FOOD/MEAT & SEAFOOD/ BACON",base,"Lethbridge Pork Butt Roast, Boneless",,,,1,Taxable Goods,"Catalog, Search",18.6408,,,,,,,/FK0009678.png,"Lethbridge Pork Butt Roast, Boneless",/FK0009678.png,,/FK0009678.png,,/FK0009678.png,,,,,,Block after Info Column,,,,Use config,,,,,,,Use config,,,,0,1,0,0,1,1,1,10000,1,0,1,1,0,0,1,1,1,0,0,0,,,,,,,,,,,,,,,,
FK0009679,,Default,virtual,"MAIN MENUBAR/FOOD/MEAT & SEAFOOD,MAIN MENUBAR/FOOD/MEAT & SEAFOOD/ CHOPS & STEAKS",base,No Name Mild Sugar-Cured Bacon (500 g),,,,1,Taxable Goods,"Catalog, Search",5.7024,,,,,,,/FK0009679.png,No Name Mild Sugar-Cured Bacon (500 g),/FK0009679.png,,/FK0009679.png,,/FK0009679.png,,,,,,Block after Info Column,,,,Use config,,,,,,,Use config,,,,0,1,0,0,1,1,1,10000,1,0,1,1,0,0,1,1,1,0,0,0,,,,,,,,,,,,,,,,
FK0009680,,Default,virtual,"MAIN MENUBAR/FOOD/MEAT & SEAFOOD,MAIN MENUBAR/FOOD/MEAT & SEAFOOD/ RIBS & ROASTS",base,Maple Leaf Lazy Maple Bacon (375 g),,,,1,Taxable Goods,"Catalog, Search",4.2876,,,,,,,/FK0009680.png,Maple Leaf Lazy Maple Bacon (375 g),/FK0009680.png,,/FK0009680.png,,/FK0009680.png,,,,,,Block after Info Column,,,,Use config,,,,,,,Use config,,,,0,1,0,0,1,1,1,10000,1,0,1,1,0,0,1,1,1,0,0,0,,,,,,,,,,,,,,,,
FK0009681,,Default,virtual,"MAIN MENUBAR/FOOD/MEAT & SEAFOOD,MAIN MENUBAR/FOOD/MEAT & SEAFOOD/ BACON",base,"Pork Loin Rib End 1/2, Frozen Club Pack",,,,1,Taxable Goods,"Catalog, Search",30.1104,,,,,,,,"Pork Loin Rib End 1/2, Frozen Club Pack",,,,,,,,,,,Block after Info Column,,,,Use config,,,,,,,Use config,,,,0,1,0,0,1,1,1,10000,1,0,1,1,0,0,1,1,1,0,0,0,,,,,,,,,,,,,,,,
FK0009682,,Default,virtual,"MAIN MENUBAR/FOOD/MEAT & SEAFOOD,MAIN MENUBAR/FOOD/MEAT & SEAFOOD/ CHOPS & STEAKS",base,"President's Choice Free From Pork Loin Rib Roast, Boneless",,,,1,Taxable Goods,"Catalog, Search",12.7332,,,,,,,,"President's Choice Free From Pork Loin Rib Roast, Boneless",,,,,,,,,,,Block after Info Column,,,,Use config,,,,,,,Use config,,,,0,1,0,0,1,1,1,10000,1,0,1,1,0,0,1,1,1,0,0,0,,,,,,,,,,,,,,,,
